{"schema_version":"1.0.0","catalog_id":"ecosystem_catalog","catalog_version":"1.0.0","maturity":"active_pr","service_manifests":[{"service_id":"organization_governance","manifest_path":"services/organization_governance.json"},{"service_id":"communication_control","manifest_path":"services/communication_control.json"},{"service_id":"orgmetra_hris","manifest_path":"services/orgmetra_hris.json"},{"service_id":"identity_federation","manifest_path":"services/identity_federation.json"},{"service_id":"llm_orchestration","manifest_path":"services/llm_orchestration.json"},{"service_id":"psychometrics_operations","manifest_path":"services/psychometrics_operations.json"},{"service_id":"mlsirm_compute","manifest_path":"services/mlsirm_compute.json"},{"service_id":"temporal_psychometrics","manifest_path":"services/temporal_psychometrics.json"},{"service_id":"semantic_catalog","manifest_path":"services/semantic_catalog.json"},{"service_id":"web_evidence_runtime","manifest_path":"services/web_evidence_runtime.json"},{"service_id":"document_dom","manifest_path":"services/document_dom.json"},{"service_id":"retrieval_fusion","manifest_path":"services/retrieval_fusion.json"},{"service_id":"message_threading","manifest_path":"services/message_threading.json"},{"service_id":"egress_policy","manifest_path":"services/egress_policy.json"},{"service_id":"inferred_lineage","manifest_path":"services/inferred_lineage.json"},{"service_id":"document_authoring","manifest_path":"services/document_authoring.json"},{"service_id":"document_preview","manifest_path":"services/document_preview.json"},{"service_id":"mhtml_ingestion","manifest_path":"services/mhtml_ingestion.json"},{"service_id":"change_data_capture","manifest_path":"services/change_data_capture.json"},{"service_id":"database_design","manifest_path":"services/database_design.json"},{"service_id":"embedding_continuity","manifest_path":"services/embedding_continuity.json"},{"service_id":"sast_governance","manifest_path":"services/sast_governance.json"},{"service_id":"security_operations","manifest_path":"services/security_operations.json"},{"service_id":"personal_life_planning","manifest_path":"services/personal_life_planning.json"},{"service_id":"rehearsal_analysis","manifest_path":"services/rehearsal_analysis.json"}],"relationships":[{"relationship_id":"identity_to_orgmetra","provider_service_id":"identity_federation","consumer_service_id":"orgmetra_hris","authoritative_data_owner_service_id":"identity_federation","contract_kind":"oauth_oidc","contract_version":"1.0.0","immutable_reference":"contract:cwl/identity_to_orgmetra@1.0.0","purpose_code":"identity_federation","data_classification":"restricted_identity","data_flow_class":"reference_only","evidence_class":"authoritative_reference","maturity":"accepted_architecture","credential_flow":"workload_identity","direct_cross_repository_sql":false,"credential_copying":false,"raw_pii_broadcast":false,"may_update_authoritative_fact":false,"next_actions":{"success":"Continue with the verified result.","rejection":"Preserve authoritative state and show the rejected requirement.","timeout":"Retry within the bounded budget or escalate.","duplicate":"Return the prior idempotent result.","rollback":"Restore the last verified contract or projection."}},{"relationship_id":"governance_to_orgmetra","provider_service_id":"organization_governance","consumer_service_id":"orgmetra_hris","authoritative_data_owner_service_id":"organization_governance","contract_kind":"build_control","contract_version":"1.0.0","immutable_reference":"contract:cwl/governance_to_orgmetra@1.0.0","purpose_code":"quality_governance","data_classification":"no_business_data","data_flow_class":"no_business_data","evidence_class":"control_evidence","maturity":"active_pr","credential_flow":"none","direct_cross_repository_sql":false,"credential_copying":false,"raw_pii_broadcast":false,"may_update_authoritative_fact":false,"next_actions":{"success":"Continue with the verified result.","rejection":"Preserve authoritative state and show the rejected requirement.","timeout":"Retry within the bounded budget or escalate.","duplicate":"Return the prior idempotent result.","rollback":"Restore the last verified contract or projection."}}]}
